{
  "$schema": "./packages/design-core/contracts/workspace.schema.json",
  "architectureVersion": "2.0.0",
  "migrationPhase": 4,
  "packages": {
    "designCore": "packages/design-core",
    "wordpressAdapter": "packages/wordpress-adapter"
  },
  "projects": {
    "intercargo": {
      "source": "projects/intercargo",
      "themeOutput": "themes/intercargo"
    }
  },
  "rules": {
    "themeRuntimeStandalone": true,
    "themeMayImportPackagesAtRuntime": false,
    "themeMayImportProjectsAtRuntime": false,
    "canonicalBlockIdsAreStable": true
  }
}
